expense_id,date,payment_type,vendor_or_entity,total_amount,account_used,project,notes
EXP001,2024-10-26,Credit Card,Amazon,220.0,Office Supplies Expense,General,"This expense covers the monthly purchase of coffee for the office, which is a necessary morale booster and common office supply. It occurs monthly and is automatically charged to the company credit card. The amount could vary slightly depending on price fluctuations. Best practice for managing this is to monitor spending and explore bulk purchase discounts if available. This expense contributes to employee satisfaction and a productive work environment. From a tax perspective, it's deductible as a business expense. Accurate categorization is important for proper tax accounting. For example, if the coffee expenses dramatically increased without a clear purpose, the company might get audited."
EXP002,2024-10-27,Bank Transfer,Ram Electronics,2500.0,Cost of Goods Sold,Hardware Chip Sales,"This expense represents the cost of purchasing hardware chips from Ram Electronics, a key supplier for X Software's hardware sales. It occurs whenever inventory levels need to be replenished to meet customer demand. The amount varies based on the quantity of chips ordered and any price changes from the supplier. Best practice is to negotiate favorable pricing with Ram Electronics and manage inventory levels effectively to avoid stockouts or excess inventory. This expense directly impacts the profitability of hardware chip sales; if chip production is delayed, the amount could vary widely. Cost of Goods Sold is directly related to revenue generated from hardware sales, and proper tracking is crucial for accurate gross profit calculation. Incorrectly classifying this expense could distort the company's profitability metrics."
EXP003,2024-10-28,Bank Transfer,Udemy,150.0,Training Expense,Software Development Team Training,"This expense covers the cost of an online course purchased on Udemy for upskilling the software development team. These purchases occur sporadically, depending on the training needs identified. The amount varies based on the course price and the number of team members enrolled. Best practice is to budget for training and prioritize courses that align with the company's strategic goals. The training improves employee skills and productivity. Training expenses are tax-deductible. If the cost of training far exceeded the value derived from that training, this would affect the financial health of X Software. Furthermore, the amount could vary greatly depending on whether X Software needed to purchase multiple course licenses, for each member of the team."
EXP004,2024-10-29,Credit Card,Google Cloud,70.0,Cloud Services Expense,Infrastructure,"This expense covers the monthly cost of Google Cloud services, which are essential for hosting X Software's applications and data. It occurs monthly and is automatically charged to the company credit card. The amount might vary slightly based on usage. Best practice is to monitor cloud usage and optimize resource allocation to control costs. Google Cloud enables the business's software development and hardware services. This is a standard monthly subscription. From a tax perspective, this is a fully deductible business expense. Classifying this expense correctly, especially differentiating it from capital expenditures, is important for accurate financial reporting."
EXP005,2024-10-30,Credit Card,OpenAI,20.0,Subscription Expense,AI Tooling,"This expense covers the monthly subscription to ChatGPT, a useful AI tool for various business tasks, including content generation, code completion, and customer support. It occurs monthly and is automatically charged to the company credit card. The expense is fixed. Best practice is to evaluate the tool's utility and ensure it's providing a positive return on investment, i.e., that use of ChatGPT improves productivity. ChatGPT improves employee effectiveness and streamlines operations. This is a standard monthly subscription, and it should be categorized accurately for proper financial reporting. For example, if X Software discontinued this subscription because it wasn't being used effectively, there would be cost savings."
EXP006,2024-10-31,Bank Transfer,Dell,5000.0,Computer Equipment Expense,Developer Laptops,"This expense covers the purchase of five laptops from Dell for software developers. It occurs periodically, depending on the need for new or replacement equipment. The cost is $1,000 per laptop. Best practice is to negotiate favorable pricing with Dell and properly maintain equipment to extend its lifespan. Computer equipment is vital for software development. Capitalization policies may determine whether this is capitalized as PP&E (Property, Plant, & Equipment) with depreciation or expensed immediately. Note that while computers are PP&E, they fall under a dollar amount threshold for PP&E and are expensed. Accurate record-keeping is crucial to ensure this expense gets reported correctly and to avoid errors in financial reporting."
EXP007,2024-10-31,Bank Transfer,Employee Payroll,9000.0,Employee Salaries Expense,General Operations,"This represents the monthly payroll expense for all employees at X Software. It occurs monthly, and is usually processed via bank transfer. The amount is relatively fixed based on current salaries. Factors that might change this cost includes raises, benefits, bonuses, or employee departures. Best practice is to manage salaries competitively to attract and retain talent, and also to properly track employee hours. This expense is critical for running the day-to-day operations of the company. Payroll taxes and withholdings have accounting and compliance requirements. Proper accounting for salaries expense is crucial for both financial reporting and tax compliance. Any errors could result in fines and penalties."
